ID,Type,Label,Title,Text
Article_2,Article Paragraph,Art. 2,Definitions,"For the purposes of this Regulation, the following definitions apply:<br><br>(1) ‘gatekeeper’ means an undertaking providing core platform services, designated pursuant to Article 3;<br><br>(2) ‘core platform service’ means any of the following: (a) online intermediation services; (b) online search engines; (c) online social networking services; (d) video-sharing platform services; (e) number-independent interpersonal communications services; (f) operating systems; (g) web browsers; (h) virtual assistants; (i) cloud computing services; (j) online advertising services, including any advertising networks, advertising exchanges and any other advertising intermediation services, provided by an undertaking that provides any of the core platform services listed in points (a) to (i);<br><br>(a) online intermediation services;<br><br>(b) online search engines;<br><br>(c) online social networking services;<br><br>(d) video-sharing platform services;<br><br>(e) number-independent interpersonal communications services;<br><br>(f) operating systems;<br><br>(g) web browsers;<br><br>(h) virtual assistants;<br><br>(i) cloud computing services;<br><br>(j) online advertising services, including any advertising networks, advertising exchanges and any other advertising intermediation services, provided by an undertaking that provides any of the core platform services listed in points (a) to (i);<br><br>(3) ‘information society service’ means any service as defined in Article 1(1), point (b), of Directive (EU) 2015/1535;<br><br>(4) ‘digital sector’ means the sector of products and services provided by means of, or through, information society services;<br><br>(5) ‘online intermediation services’ means online intermediation services as defined in Article 2, point (2), of Regulation (EU) 2019/1150;<br><br>(6) ‘online search engine’ means an online search engine as defined in Article 2, point (5), of Regulation (EU) 2019/1150;<br><br>(7) ‘online social networking service’ means a platform that enables end users to connect and communicate with each other, share content and discover other users and content across multiple devices and, in particular, via chats, posts, videos and recommendations;<br><br>(8) ‘video-sharing platform service’ means a video-sharing platform service as defined in Article 1(1), point (aa), of Directive 2010/13/EU;<br><br>(9) ‘number-independent interpersonal communications service’ means a number-independent interpersonal communications service as defined in Article 2, point (7), of Directive (EU) 2018/1972;<br><br>(10) ‘operating system’ means a system software that controls the basic functions of the hardware or software and enables software applications to run on it;<br><br>(11) ‘web browser’ means a software application that enables end users to access and interact with web content hosted on servers that are connected to networks such as the Internet, including standalone web browsers as well as web browsers integrated or embedded in software or similar;<br><br>(12) ‘virtual assistant’ means a software that can process demands, tasks or questions, including those based on audio, visual, written input, gestures or motions, and that, based on those demands, tasks or questions, provides access to other services or controls connected physical devices;<br><br>(13) ‘cloud computing service’ means a cloud computing service as defined in Article 4, point (19), of Directive (EU) 2016/1148 of the European Parliament and of the Council ( 24 ) ;<br><br>(14) ‘software application stores’ means a type of online intermediation services, which is focused on software applications as the intermediated product or service;<br><br>(15) ‘software application’ means any digital product or service that runs on an operating system;<br><br>(16) ‘payment service’ means a payment service as defined in Article 4, point (3) of Directive (EU) 2015/2366;<br><br>(17) ‘technical service supporting payment service’ means a service within the meaning of Article 3, point (j), of Directive (EU) 2015/2366;<br><br>(18) ‘payment system for in-app purchases’ means a software application, service or user interface which facilitates purchases of digital content or digital services within a software application, including content, subscriptions, features or functionality, and the payments for such purchases;<br><br>(19) ‘identification service’ means a type of service provided together with or in support of core platform services that enables any type of verification of the identity of end users or business users, regardless of the technology used;<br><br>(20) ‘end user’ means any natural or legal person using core platform services other than as a business user;<br><br>(21) ‘business user’ means any natural or legal person acting in a commercial or professional capacity using core platform services for the purpose of or in the course of providing goods or services to end users;<br><br>(22) ‘ranking’ means the relative prominence given to goods or services offered through online intermediation services, online social networking services, video-sharing platform services or virtual assistants, or the relevance given to search results by online search engines, as presented, organised or communicated by the undertakings providing online intermediation services, online social networking services, video-sharing platform services, virtual assistants or online search engines, irrespective of the technological means used for such presentation, organisation or communication and irrespective of whether only one result is presented or communicated;<br><br>(23) ‘search results’ means any information in any format, including textual, graphic, vocal or other outputs, returned in response to, and related to, a search query, irrespective of whether the information returned is a paid or an unpaid result, a direct answer or any product, service or information offered in connection with the organic results, or displayed along with or partly or entirely embedded in them;<br><br>(24) ‘data’ means any digital representation of acts, facts or information and any compilation of such acts, facts or information, including in the form of sound, visual or audiovisual recording;<br><br>(25) ‘personal data’ means personal data as defined in Article 4, point (1), of Regulation (EU) 2016/679;<br><br>(26) ‘non-personal data’ means data other than personal data;<br><br>(27) ‘undertaking’ means an entity engaged in an economic activity, regardless of its legal status and the way in which it is financed, including all linked enterprises or connected undertakings that form a group through the direct or indirect control of an enterprise or undertaking by another;<br><br>(28) ‘control’ means the possibility of exercising decisive influence on an undertaking, within the meaning of Article 3(2) of Regulation (EC) No 139/2004;<br><br>(29) ‘interoperability’ means the ability to exchange information and mutually use the information which has been exchanged through interfaces or other solutions, so that all elements of hardware or software work with other hardware and software and with users in all the ways in which they are intended to function;<br><br>(30) ‘turnover’ means the amount derived by an undertaking within the meaning of Article 5(1) of Regulation (EC) No 139/2004;<br><br>(31) ‘profiling’ means profiling as defined in Article 4, point (4), of Regulation (EU) 2016/679;<br><br>(32) ‘consent’ means consent as defined in Article 4, point (11), of Regulation (EU) 2016/679;<br><br>(33) ‘national court’ means a court or tribunal of a Member State within the meaning of Article 267 TFEU."
CH_166,Chapter,CHAPTER II: GATEKEEPERS,,
Article_3,Article Paragraph,Art. 3,Designation of gatekeepers,"1.   An undertaking shall be designated as a gatekeeper if:<br><br>(a) it has a significant impact on the internal market;<br><br>(b) it provides a core platform service which is an important gateway for business users to reach end users; and<br><br>(c) it enjoys an entrenched and durable position, in its operations, or it is foreseeable that it will enjoy such a position in the near future.<br><br>2.   An undertaking shall be presumed to satisfy the respective requirements in paragraph 1:<br><br>(a) as regards paragraph 1, point (a), where it achieves an annual Union turnover equal to or above EUR 7,5 billion in each of the last three financial years, or where its average market capitalisation or its equivalent fair market value amounted to at least EUR 75 billion in the last financial year, and it provides the same core platform service in at least three Member States;<br><br>(b) as regards paragraph 1, point (b), where it provides a core platform service that in the last financial year has at least 45 million monthly active end users established or located in the Union and at least 10 000 yearly active business users established in the Union, identified and calculated in accordance with the methodology and indicators set out in the Annex;<br><br>(c) as regards paragraph 1, point (c), where the thresholds in point (b) of this paragraph were met in each of the last three financial years.<br><br>3.   Where an undertaking providing core platform services meets all of the thresholds in paragraph 2, it shall notify the Commission thereof without delay and in any event within 2 months after those thresholds are met and provide it with the relevant information identified in paragraph 2. That notification shall include the relevant information identified in paragraph 2 for each of the core platform services of the undertaking that meets the thresholds in paragraph 2, point (b). Whenever a further core platform service provided by the undertaking that has previously been designated as a gatekeeper meets the thresholds in paragraph 2, points (b) and (c), such undertaking shall notify the Commission thereof within 2 months after those thresholds are satisfied.<br><br>Where the undertaking providing the core platform service fails to notify the Commission pursuant to the first subparagraph of this paragraph and fails to provide within the deadline set by the Commission in the request for information pursuant to Article 21 all the relevant information that is required for the Commission to designate the undertaking concerned as gatekeeper pursuant to paragraph 4 of this Article, the Commission shall still be entitled to designate that undertaking as a gatekeeper, based on information available to the Commission.<br><br>Where the undertaking providing core platform services complies with the request for information pursuant to the second subparagraph of this paragraph or where the information is provided after the expiration of the deadline referred to in that subparagraph, the Commission shall apply the procedure set out in paragraph 4.<br><br>4.   The Commission shall designate as a gatekeeper, without undue delay and at the latest within 45 working days after receiving the complete information referred to in paragraph 3, an undertaking providing core platform services that meets all the thresholds in paragraph 2.<br><br>5.   The undertaking providing core platform services may present, with its notification, sufficiently substantiated arguments to demonstrate that, exceptionally, although it meets all the thresholds in paragraph 2, due to the circumstances in which the relevant core platform service operates, it does not satisfy the requirements listed in paragraph 1.<br><br>Where the Commission considers that the arguments submitted pursuant to the first subparagraph by the undertaking providing core platform services are not sufficiently substantiated because they do not manifestly call into question the presumptions set out in paragraph 2 of this Article, it may reject those arguments within the time limit referred to in paragraph 4, without applying the procedure laid down in Article 17(3).<br><br>Where the undertaking providing core platform services does present such sufficiently substantiated arguments manifestly calling into question the presumptions in paragraph 2 of this Article, the Commission may, notwithstanding the first subparagraph of this paragraph, within the time limit referred to in paragraph 4 of this Article, open the procedure laid down in Article 17(3).<br><br>If the Commission concludes that the undertaking providing core platform services was not able to demonstrate that the relevant core platform services that it provides do not satisfy the requirements of paragraph 1 of this Article, it shall designate that undertaking as a gatekeeper in accordance with the procedure laid down in Article 17(3).<br><br>6.   The Commission is empowered to adopt delegated acts in accordance with Article 49 to supplement this Regulation by specifying the methodology for determining whether the quantitative thresholds laid down in paragraph 2 of this Article are met, and to regularly adjust that methodology to market and technological developments, where necessary.<br><br>7.   The Commission is empowered to adopt delegated acts in accordance with Article 49 to amend this Regulation by updating the methodology and the list of indicators set out in the Annex.<br><br>8.   The Commission shall designate as a gatekeeper, in accordance with the procedure laid down in Article 17, any undertaking providing core platform services that meets each of the requirements of paragraph 1 of this Article, but does not satisfy each of the thresholds in paragraph 2 of this Article.<br><br>For that purpose, the Commission shall take into account some or all of the following elements, insofar as they are relevant for the undertaking providing core platform services under consideration:<br><br>(a) the size, including turnover and market capitalisation, operations and position of that undertaking;<br><br>(b) the number of business users using the core platform service to reach end users and the number of end users;<br><br>(c) network effects and data driven advantages, in particular in relation to that undertaking’s access to, and collection of, personal data and non-personal data or analytics capabilities;<br><br>(d) any scale and scope effects from which the undertaking benefits, including with regard to data, and, where relevant, to its activities outside the Union;<br><br>(e) business user or end user lock-in, including switching costs and behavioural bias reducing the ability of business users and end users to switch or multi-home;<br><br>(f) a conglomerate corporate structure or vertical integration of that undertaking, for instance enabling that undertaking to cross subsidise, to combine data from different sources or to leverage its position; or<br><br>(g) other structural business or service characteristics.<br><br>In carrying out its assessment under this paragraph, the Commission shall take into account foreseeable developments in relation to the elements listed in the second subparagraph, including any planned concentrations involving another undertaking providing core platform services or providing any other services in the digital sector or enabling the collection of data.<br><br>Where an undertaking providing a core platform service that does not satisfy the quantitative thresholds of paragraph 2 fails to comply with the investigative measures ordered by the Commission in a significant manner, and that failure persists after that undertaking has been invited to comply within a reasonable time limit and to submit observations, the Commission may designate that undertaking as a gatekeeper on the basis of the facts available to the Commission.<br><br>9.   For each undertaking designated as a gatekeeper pursuant to paragraph 4 or 8, the Commission shall list in the designation decision the relevant core platform services that are provided within that undertaking and which individually are an important gateway for business users to reach end users as referred to in paragraph 1, point (b).<br><br>10.   The gatekeeper shall comply with the obligations laid down in Articles 5, 6 and 7 within 6 months after a core platform service has been listed in the designation decision pursuant to paragraph 9 of this Article."
Article_4,Article Paragraph,Art. 4,Review of the status of gatekeeper,"1.   The Commission may, upon request or on its own initiative, reconsider, amend or repeal at any moment a designation decision adopted pursuant to Article 3 for one of the following reasons:<br><br>(a) there has been a substantial change in any of the facts on which the designation decision was based;<br><br>(b) the designation decision was based on incomplete, incorrect or misleading information.<br><br>2.   The Commission shall regularly, and at least every 3 years, review whether the gatekeepers continue to satisfy the requirements laid down in Article 3(1). That review shall also examine whether the list of core platform services of the gatekeeper which are individually an important gateway for business users to reach end users, as referred to in Article 3(1), point (b), needs to be amended. Those reviews shall have no suspending effect on the gatekeeper’s obligations.<br><br>The Commission shall also examine at least every year whether new undertakings providing core platform services satisfy those requirements.<br><br>Where the Commission, on the basis of the reviews pursuant to the first subparagraph, finds that the facts on which the designation of the undertakings providing core platform services as gatekeepers was based, have changed, it shall adopt a decision confirming, amending or repealing the designation decision.<br><br>3.   The Commission shall publish and update a list of gatekeepers and the list of the core platform services for which they need to comply with the obligations laid down in Chapter III on an on-going basis."
CH_205,Chapter,CHAPTER III: PRACTICES OF GATEKEEPERS THAT LIMIT CONTESTABILITY OR ARE UNFAIR,,
Article_5_1,Article Paragraph,Art. 5(1),Obligations for gatekeepers,1.   The gatekeeper shall comply with all obligations set out in this Article with respect to each of its core platform services listed in the designation decision pursuant to Article 3(9).
Article_5_2,Article Paragraph,Art. 5(2),Obligations for gatekeepers,"2.   The gatekeeper shall not do any of the following:<br><br>(a) process, for the purpose of providing online advertising services, personal data of end users using services of third parties that make use of core platform services of the gatekeeper;<br><br>(b) combine personal data from the relevant core platform service with personal data from any further core platform services or from any other services provided by the gatekeeper or with personal data from third-party services;<br><br>(c) cross-use personal data from the relevant core platform service in other services provided separately by the gatekeeper, including other core platform services, and vice versa; and<br><br>(d) sign in end users to other services of the gatekeeper in order to combine personal data,<br><br>unless the end user has been presented with the specific choice and has given consent within the meaning of Article 4, point (11), and Article 7 of Regulation (EU) 2016/679.<br><br>Where the consent given for the purposes of the first subparagraph has been refused or withdrawn by the end user, the gatekeeper shall not repeat its request for consent for the same purpose more than once within a period of one year.<br><br>This paragraph is without prejudice to the possibility for the gatekeeper to rely on Article 6(1), points (c), (d) and (e) of Regulation (EU) 2016/679, where applicable."
Article_5_3,Article Paragraph,Art. 5(3),Obligations for gatekeepers,3.   The gatekeeper shall not prevent business users from offering the same products or services to end users through third-party online intermediation services or through their own direct online sales channel at prices or conditions that are different from those offered through the online intermediation services of the gatekeeper.
Article_5_4,Article Paragraph,Art. 5(4),Obligations for gatekeepers,"4.   The gatekeeper shall allow business users, free of charge, to communicate and promote offers, including under different conditions, to end users acquired via its core platform service or through other channels, and to conclude contracts with those end users, regardless of whether, for that purpose, they use the core platform services of the gatekeeper."
Article_5_5,Article Paragraph,Art. 5(5),Obligations for gatekeepers,"5.   The gatekeeper shall allow end users to access and use, through its core platform services, content, subscriptions, features or other items, by using the software application of a business user, including where those end users acquired such items from the relevant business user without using the core platform services of the gatekeeper."
Article_5_6,Article Paragraph,Art. 5(6),Obligations for gatekeepers,"6.   The gatekeeper shall not directly or indirectly prevent or restrict business users or end users from raising any issue of non-compliance with the relevant Union or national law by the gatekeeper with any relevant public authority, including national courts, related to any practice of the gatekeeper. This is without prejudice to the right of business users and gatekeepers to lay down in their agreements the terms of use of lawful complaints-handling mechanisms."
Article_5_7,Article Paragraph,Art. 5(7),Obligations for gatekeepers,"7.   The gatekeeper shall not require end users to use, or business users to use, to offer, or to interoperate with, an identification service, a web browser engine or a payment service, or technical services that support the provision of payment services, such as payment systems for in-app purchases, of that gatekeeper in the context of services provided by the business users using that gatekeeper’s core platform services."
Article_5_8,Article Paragraph,Art. 5(8),Obligations for gatekeepers,"8.   The gatekeeper shall not require business users or end users to subscribe to, or register with, any further core platform services listed in the designation decision pursuant to Article 3(9) or which meet the thresholds in Article 3(2), point (b), as a condition for being able to use, access, sign up for or registering with any of that gatekeeper’s core platform services listed pursuant to that Article."
Article_5_9,Article Paragraph,Art. 5(9),Obligations for gatekeepers,"9.   The gatekeeper shall provide each advertiser to which it supplies online advertising services, or third parties authorised by advertisers, upon the advertiser’s request, with information on a daily basis free of charge, concerning each advertisement placed by the advertiser, regarding:<br><br>(a) the price and fees paid by that advertiser, including any deductions and surcharges, for each of the relevant online advertising services provided by the gatekeeper,<br><br>(b) the remuneration received by the publisher, including any deductions and surcharges, subject to the publisher’s consent; and<br><br>(c) the metrics on which each of the prices, fees and remunerations are calculated.<br><br>In the event that a publisher does not consent to the sharing of information regarding the remuneration received, as referred to in point (b) of the first subparagraph, the gatekeeper shall provide each advertiser free of charge with information concerning the daily average remuneration received by that publisher, including any deductions and surcharges, for the relevant advertisements."
Article_5_10,Article Paragraph,Art. 5(10),Obligations for gatekeepers,"10.   The gatekeeper shall provide each publisher to which it supplies online advertising services, or third parties authorised by publishers, upon the publisher’s request, with free of charge information on a daily basis, concerning each advertisement displayed on the publisher’s inventory, regarding:<br><br>(a) the remuneration received and the fees paid by that publisher, including any deductions and surcharges, for each of the relevant online advertising services provided by the gatekeeper;<br><br>(b) the price paid by the advertiser, including any deductions and surcharges, subject to the advertiser’s consent; and<br><br>(c) the metrics on which each of the prices and remunerations are calculated.<br><br>In the event an advertiser does not consent to the sharing of information, the gatekeeper shall provide each publisher free of charge with information concerning the daily average price paid by that advertiser, including any deductions and surcharges, for the relevant advertisements."
Article_6_1,Article Paragraph,Art. 6(1),Obligations for gatekeepers susceptible of being further specified under Article 8,1.   The Gatekeeper shall comply with all obligations set out in this Article with respect to each of its core platform services listed in the designation decision pursuant to Article 3(9).
