ID,Type,Label,Title,Text
REC_1,Recital,Recital (1),,"(1) Digital services in general and online platforms in particular play an increasingly important role in the economy, in particular in the internal market, by enabling businesses to reach users throughout the Union, by facilitating cross-border trade and by opening entirely new business opportunities to a large number of companies in the Union to the benefit of consumers in the Union."
REC_2,Recital,Recital (2),,"(2) At the same time, among those digital services, core platform services feature a number of characteristics that can be exploited by the undertakings providing them. An example of such characteristics of core platform services is extreme scale economies, which often result from nearly zero marginal costs to add business users or end users. Other such characteristics of core platform services are very strong network effects, an ability to connect many business users with many end users through the multisidedness of these services, a significant degree of dependence of both business users and end users, lock-in effects, a lack of multi-homing for the same purpose by end users, vertical integration, and data driven-advantages. All these characteristics, combined with unfair practices by undertakings providing the core platform services, can have the effect of substantially undermining the contestability of the core platform services, as well as impacting the fairness of the commercial relationship between undertakings providing such services and their business users and end users. In practice, this leads to rapid and potentially far-reaching decreases in business users’ and end users’ choice, and therefore can confer on the provider of those services the position of a so-called gatekeeper. At the same time, it should be recognised that services which act in a non-commercial purpose capacity such as collaborative projects should not be considered as core platform services for the purpose of this Regulation."
REC_3,Recital,Recital (3),,"(3) A small number of large undertakings providing core platform services have emerged with considerable economic power that could qualify them to be designated as gatekeepers pursuant to this Regulation. Typically, they feature an ability to connect many business users with many end users through their services, which, in turn, enables them to leverage their advantages, such as their access to large amounts of data, from one area of activity to another. Some of those undertakings exercise control over whole platform ecosystems in the digital economy and are structurally extremely difficult to challenge or contest by existing or new market operators, irrespective of how innovative and efficient those market operators may be. Contestability is reduced in particular due to the existence of very high barriers to entry or exit, including high investment costs, which cannot, or not easily, be recuperated in case of exit, and the absence of, or reduced access to, some key inputs in the digital economy, such as data. As a result, the likelihood increases that the underlying markets do not function well, or will soon fail to function well."
REC_4,Recital,Recital (4),,"(4) The combination of those features of gatekeeper is likely to lead, in many cases, to serious imbalances in bargaining power and, consequently, to unfair practices and conditions for business users, as well as for end users of core platform services provided by gatekeepers, to the detriment of prices, quality, fair competition, choice and innovation in the digital sector."
REC_5,Recital,Recital (5),,"(5) It follows that the market processes are often incapable of ensuring fair economic outcomes with regard to core platform services. Although Articles 101 and 102 of the Treaty on the Functioning of the European Union (TFEU) apply to the conduct of gatekeepers, the scope of those provisions is limited to certain instances of market power, for example dominance on specific markets and of anti-competitive behaviour, and enforcement occurs ex post and requires an extensive investigation of often very complex facts on a case by case basis. Moreover, existing Union law does not address, or does not address effectively, the challenges to the effective functioning of the internal market posed by the conduct of gatekeepers that are not necessarily dominant in competition-law terms."
REC_6,Recital,Recital (6),,"(6) Gatekeepers have a significant impact on the internal market, providing gateways for a large number of business users to reach end users everywhere in the Union and on different markets. The adverse impact of unfair practices on the internal market and the particularly weak contestability of core platform services, including the negative societal and economic implications of such unfair practices, have led national legislators and sectoral regulators to act. A number of regulatory solutions have already been adopted at national level or proposed to address unfair practices and the contestability of digital services or at least with regard to some of them. This has created divergent regulatory solutions which results in the fragmentation of the internal market, thus raising the risk of increased compliance costs due to different sets of national regulatory requirements."
REC_7,Recital,Recital (7),,"(7) Therefore, the purpose of this Regulation is to contribute to the proper functioning of the internal market by laying down rules to ensure contestability and fairness for the markets in the digital sector in general, and for business users and end users of core platform services provided by gatekeepers in particular. Business users and end users of core platform services provided by gatekeepers should be afforded appropriate regulatory safeguards throughout the Union against the unfair practices of gatekeepers, in order to facilitate cross-border business within the Union and thereby improve the proper functioning of the internal market, and to eliminate existing or likely emerging fragmentation in the specific areas covered by this Regulation. Moreover, while gatekeepers tend to adopt global or at least pan-European business models and algorithmic structures, they can adopt, and in some cases have adopted, different business conditions and practices in different Member States, which is liable to create disparities between the competitive conditions for the users of core platform services provided by gatekeepers, to the detriment of integration of the internal market."
REC_8,Recital,Recital (8),,"(8) By approximating diverging national laws, it is possible to eliminate obstacles to the freedom to provide and receive services, including retail services, within the internal market. A targeted set of harmonised legal obligations should therefore be established at Union level to ensure contestable and fair digital markets featuring the presence of gatekeepers within the internal market to the benefit of the Union’s economy as a whole and ultimately of the Union’s consumers."
REC_9,Recital,Recital (9),,(9) Fragmentation of the internal market can only effectively be averted if Member States are prevented from applying national rules which are within the scope of and pursue the same objectives as this Regulation. That does not preclude the possibility of applying to gatekeepers within the meaning of this Regulation other national rules which pursue other legitimate public interest objectives as set out in the TFEU or which pursue overriding reasons of public interest as recognised by the case law of the Court of Justice of the European Union (‘the Court of Justice’).
REC_10,Recital,Recital (10),,"(10) At the same time, since this Regulation aims to complement the enforcement of competition law, it should apply without prejudice to Articles 101 and 102 TFEU, to the corresponding national competition rules and to other national competition rules regarding unilateral conduct that are based on an individualised assessment of market positions and behaviour, including its actual or potential effects and the precise scope of the prohibited behaviour, and which provide for the possibility of undertakings to make efficiency and objective justification arguments for the behaviour in question, and to national rules concerning merger control. However, the application of those rules should not affect the obligations imposed on gatekeepers under this Regulation and their uniform and effective application in the internal market."
REC_11,Recital,Recital (11),,"(11) Articles 101 and 102 TFEU and the corresponding national competition rules concerning anticompetitive multilateral and unilateral conduct as well as merger control have as their objective the protection of undistorted competition on the market. This Regulation pursues an objective that is complementary to, but different from that of protecting undistorted competition on any given market, as defined in competition-law terms, which is to ensure that markets where gatekeepers are present are and remain contestable and fair, independently from the actual, potential or presumed effects of the conduct of a given gatekeeper covered by this Regulation on competition on a given market. This Regulation therefore aims to protect a different legal interest from that protected by those rules and it should apply without prejudice to their application."
REC_12,Recital,Recital (12),,"(12) This Regulation should also apply without prejudice to the rules resulting from other acts of Union law regulating certain aspects of the provision of services covered by this Regulation, in particular Regulations (EU) 2016/679 ( 4 ) and (EU) 2019/1150 ( 5 ) of the European Parliament and of the Council and a Regulation on a single market for digital services, and Directives 2002/58/EC ( 6 ) , 2005/29/EC ( 7 ) , 2010/13/EU ( 8 ) , (EU) 2015/2366 ( 9 ) , (EU) 2019/790 ( 10 ) and (EU) 2019/882 ( 11 ) of the European Parliament and of the Council, and Council Directive 93/13/EEC ( 12 ) , as well as national rules aimed at enforcing or implementing those Union legal acts."
REC_13,Recital,Recital (13),,"(13) Weak contestability and unfair practices in the digital sector are more frequent and pronounced for certain digital services than for others. This is the case in particular for widespread and commonly used digital services that mostly directly intermediate between business users and end users and where features such as extreme scale economies, very strong network effects, an ability to connect many business users with many end users through the multisidedness of these services, lock-in effects, a lack of multi-homing or vertical integration are the most prevalent. Often, there is only one or very few large undertakings providing those digital services. Those undertakings have emerged most frequently as gatekeepers for business users and end users, with far-reaching impacts. In particular, they have gained the ability to easily set commercial conditions and terms in a unilateral and detrimental manner for their business users and end users. Accordingly, it is necessary to focus only on those digital services that are most broadly used by business users and end users and where concerns about weak contestability and unfair practices by gatekeepers are more apparent and pressing from an internal market perspective."
REC_14,Recital,Recital (14),,"(14) In particular, online intermediation services, online search engines, operating systems, online social networking, video sharing platform services, number-independent interpersonal communication services, cloud computing services, virtual assistants, web browsers and online advertising services, including advertising intermediation services, all have the capacity to affect a large number of end users and businesses, which entails a risk of unfair business practices. Therefore, they should be included in the definition of core platform services and fall into the scope of this Regulation. Online intermediation services can also be active in the field of financial services, and they can intermediate or be used to provide such services as listed non-exhaustively in Annex II to Directive (EU) 2015/1535 of the European Parliament and of the Council ( 13 ) . For the purposes of this Regulation, the definition of core platform services should be technology neutral and should be understood to encompass those provided on or through various means or devices, such as connected TV or embedded digital services in vehicles. In certain circumstances, the notion of end users should encompass users that are traditionally considered business users, but in a given situation do not use the core platform services to provide goods or services to other end users, such as for example businesses relying on cloud computing services for their own purposes."
REC_15,Recital,Recital (15),,"(15) The fact that a digital service qualifies as a core platform service does not in itself give rise to sufficiently serious concerns of contestability or unfair practices. It is only when a core platform service constitutes an important gateway and is operated by an undertaking with a significant impact in the internal market and an entrenched and durable position, or by an undertaking that will foreseeably enjoy such a position in the near future, that such concerns arise. Accordingly, the targeted set of harmonised rules in this Regulation should apply only to undertakings designated on the basis of those three objective criteria, and they should only apply to those of their core platform services that individually constitute an important gateway for business users to reach end users. The fact that it is possible that an undertaking providing core platform services not only intermediates between business users and end users, but also between end users and end users, for example in the case of number-independent interpersonal communications services, should not preclude the conclusion that such an undertaking is or could be an important gateway for business users to reach end users."
REC_16,Recital,Recital (16),,"(16) In order to ensure the effective application of this Regulation to undertakings providing core platform services which are most likely to satisfy those objective requirements, and where unfair practices weakening contestability are most prevalent and have the most impact, the Commission should be able to directly designate as gatekeepers those undertakings providing core platform services which meet certain quantitative thresholds. Such undertakings should in any event be subject to a fast designation process which should start once this Regulation becomes applicable."
REC_17,Recital,Recital (17),,"(17) The fact that an undertaking has a very significant turnover in the Union and provides a core platform service in at least three Member States constitutes compelling indication that that undertaking has a significant impact on the internal market. This is equally true where an undertaking providing a core platform service in at least three Member States has a very significant market capitalisation or equivalent fair market value. Therefore, an undertaking providing a core platform service should be presumed to have a significant impact on the internal market where it provides a core platform service in at least three Member States and where either its group turnover realised in the Union is equal to or exceeds a specific, high threshold, or the market capitalisation of the group is equal to or exceeds a certain high absolute value. For undertakings providing core platform services that belong to undertakings that are not publicly listed, the equivalent fair market value should be used as the reference. It should be possible for the Commission to use its power to adopt delegated acts to develop an objective methodology to calculate that value. A high group turnover realised in the Union in conjunction with the threshold number of users in the Union of core platform services reflects a relatively strong ability to monetise those users. A high market capitalisation relative to the same threshold number of users in the Union reflects a relatively significant potential to monetise those users in the near future. This monetisation potential in turn reflects, in principle, the gateway position of the undertakings concerned. Both indicators, in addition, reflect the financial capacity of the undertakings concerned, including their ability to leverage their access to financial markets to reinforce their position. This can, for example, happen where this superior access is used to acquire other undertakings, an ability which has in turn been shown to have potential negative effects on innovation. Market capitalisation can also reflect the expected future position and effect on the internal market of the undertakings concerned, despite a potentially relatively low current turnover. The market capitalisation value should be based on a level that reflects the average market capitalisation of the largest publicly listed undertakings in the Union over an appropriate period."
REC_18,Recital,Recital (18),,"(18) Whereas a market capitalisation at or above the threshold in the last financial year should give rise to a presumption that an undertaking providing core platform services has a significant impact on the internal market, a sustained market capitalisation of the undertaking providing core platform services at or above the threshold over three or more years should be considered as further strengthening that presumption."
REC_19,Recital,Recital (19),,"(19) By contrast, there could be a number of factors concerning market capitalisation that would require an in-depth assessment in determining whether an undertaking providing core platform services should be deemed to have a significant impact on the internal market. This could be the case where the market capitalisation of the undertaking providing core platform services in preceding financial years was significantly lower than the threshold and the volatility of its market capitalisation over the observed period was disproportionate to overall equity market volatility or its market capitalisation trajectory relative to market trends was inconsistent with a rapid and unidirectional growth."
REC_20,Recital,Recital (20),,"(20) Having a very high number of business users that depend on a core platform service to reach a very high number of monthly active end users enables the undertaking providing that service to influence the operations of a substantial part of business users to its advantage and indicate, in principle, that that undertaking is an important gateway. The respective relevant levels for those numbers should be set representing a substantive percentage of the entire population of the Union when it comes to end users and of the entire population of businesses using core platform services to determine the threshold for business users. Active end users and business users should be identified and calculated in such a way as to adequately represent the role and reach of the specific core platform service in question. In order to provide legal certainty for gatekeepers, the elements to determine the number of active end users and business users per core platform service should be set out in an Annex to this Regulation. Such elements can be affected by technological and other developments. The Commission should therefore be empowered to adopt delegated acts to amend this Regulation by updating the methodology and the list of indicators used to determine the number of active end users and active business users."
REC_21,Recital,Recital (21),,(21) An entrenched and durable position in its operations or the foreseeability of enjoying such a position in the future occurs notably where the contestability of the position of the undertaking providing the core platform service is limited. This is likely to be the case where that undertaking has provided a core platform service in at least three Member States to a very high number of business users and end users over a period of at least 3 years.
REC_22,Recital,Recital (22),,"(22) Such thresholds can be affected by market and technical developments. The Commission should therefore be empowered to adopt delegated acts to specify the methodology for determining whether the quantitative thresholds are met, and to regularly adjust it to market and technological developments where necessary. Such delegated acts should not amend the quantitative thresholds set out in this Regulation."
REC_23,Recital,Recital (23),,"(23) An undertaking providing core platform services should be able, in exceptional circumstances, to rebut the presumption that the undertaking has a significant impact on the internal market by demonstrating that, although it meets the quantitative thresholds set out in this Regulation, it does not fulfil the requirements for designation as a gatekeeper. The burden of adducing evidence that the presumption deriving from the fulfilment of the quantitative thresholds should not apply should be borne by that undertaking. In its assessment of the evidence and arguments produced, the Commission should take into account only those elements which directly relate to the quantitative criteria, namely the impact of the undertaking providing core platform services on the internal market beyond revenue or market cap, such as its size in absolute terms, and the number of Member States in which it is present; by how much the actual business user and end user numbers exceed the thresholds and the importance of the undertaking’s core platform service considering the overall scale of activities of the respective core platform service; and the number of years for which the thresholds have been met. Any justification on economic grounds seeking to enter into market definition or to demonstrate efficiencies deriving from a specific type of behaviour by the undertaking providing core platform services should be discarded, as it is not relevant to the designation as a gatekeeper. If the arguments submitted are not sufficiently substantiated because they do not manifestly put into question the presumption, it should be possible for the Commission to reject the arguments within the timeframe of 45 working days provided for the designation. The Commission should be able to take a decision by relying on information available on the quantitative thresholds where the undertaking providing core platform services obstructs the investigation by failing to comply with the investigative measures taken by the Commission."
REC_24,Recital,Recital (24),,"(24) Provision should also be made for the assessment of the gatekeeper role of undertakings providing core platform services which do not satisfy all of the quantitative thresholds, in light of the overall objective requirements that they have a significant impact on the internal market, act as an important gateway for business users to reach end users and benefit from an entrenched and durable position in their operations or it is foreseeable that they will do so in the near future. When the undertaking providing core platform services is a medium-sized, small or micro enterprise, the assessment should carefully take into account whether such an undertaking would be able to substantially undermine the contestability of the core platform services, since this Regulation primarily targets large undertakings with considerable economic power rather than medium-sized, small or micro enterprises."
REC_25,Recital,Recital (25),,"(25) Such an assessment can only be done in light of a market investigation, while taking into account the quantitative thresholds. In its assessment the Commission should pursue the objectives of preserving and fostering innovation and the quality of digital products and services, the degree to which prices are fair and competitive, and the degree to which quality or choice for business users and for end users is or remains high. Elements can be taken into account that are specific to the undertakings providing core platform services concerned, such as extreme scale or scope economies, very strong network effects, data-driven advantages, an ability to connect many business users with many end users through the multisidedness of those services, lock-in effects, lack of multi-homing, conglomerate corporate structure or vertical integration. In addition, a very high market capitalisation, a very high ratio of equity value over profit or a very high turnover derived from end users of a single core platform service can be used as indicators of the leveraging potential of such undertakings and of the tipping of the market in their favour. Together with market capitalisation, high relative growth rates are examples of dynamic parameters that are particularly relevant to identifying such undertakings providing core platform services for which it is foreseeable that they will become entrenched and durable. The Commission should be able to take a decision by drawing adverse inferences from facts available where the undertaking providing core platform services significantly obstructs the investigation by failing to comply with the investigative measures taken by the Commission."
