ID,Type,Label,Title,Text
REC_47,Recital,Recital (47),,"(47) Business users can also purchase online advertising services from an undertaking providing core platform services for the purpose of providing goods and services to end users. In this case, it can happen that the data are not generated on the core platform service, but are provided to the core platform service by the business user or are generated based on its operations through the core platform service concerned. In certain instances, that core platform service providing advertising can have a dual role as both an undertaking providing online advertising services and an undertaking providing services competing with business users. Accordingly, the obligation prohibiting a dual role gatekeeper from using data of business users should apply also with respect to the data that a core platform service has received from businesses for the purpose of providing online advertising services related to that core platform service."
REC_48,Recital,Recital (48),,"(48) In relation to cloud computing services, the obligation not to use the data of business users should extend to data provided or generated by business users of the gatekeeper in the context of their use of the cloud computing service of the gatekeeper, or through its software application store that allows end users of cloud computing services access to software applications. That obligation should not affect the right of the gatekeeper to use aggregated data for providing other services provided together with, or in support of, its core platform service, such as data analytics services, subject to compliance with Regulation (EU) 2016/679 and Directive 2002/58/EC, as well as with the relevant obligations in this Regulation concerning such services."
REC_49,Recital,Recital (49),,"(49) A gatekeeper can use different means to favour its own or third-party services or products on its operating system, virtual assistant or web browser, to the detriment of the same or similar services that end users could obtain through other third parties. This can for instance happen where certain software applications or services are pre-installed by a gatekeeper. To enable end user choice, gatekeepers should not prevent end users from un-installing any software applications on their operating system. It should be possible for the gatekeeper to restrict such un-installation only when such software applications are essential to the functioning of the operating system or the device. Gatekeepers should also allow end users to easily change the default settings on the operating system, virtual assistant and web browser when those default settings favour their own software applications and services. This includes prompting a choice screen, at the moment of the users’ first use of an online search engine, virtual assistant or web browser of the gatekeeper listed in the designation decision, allowing end users to select an alternative default service when the operating system of the gatekeeper directs end users to those online search engine, virtual assistant or web browser and when the virtual assistant or the web browser of the gatekeeper direct the user to the online search engine listed in the designation decision."
REC_50,Recital,Recital (50),,"(50) The rules that a gatekeeper sets for the distribution of software applications can, in certain circumstances, restrict the ability of end users to install and effectively use third-party software applications or software application stores on hardware or operating systems of that gatekeeper and restrict the ability of end users to access such software applications or software application stores outside the core platform services of that gatekeeper. Such restrictions can limit the ability of developers of software applications to use alternative distribution channels and the ability of end users to choose between different software applications from different distribution channels and should be prohibited as unfair and liable to weaken the contestability of core platform services. To ensure contestability, the gatekeeper should furthermore allow the third-party software applications or software application stores to prompt the end user to decide whether that service should become the default and enable that change to be carried out easily. In order to ensure that third-party software applications or software application stores do not endanger the integrity of the hardware or operating system provided by the gatekeeper, it should be possible for the gatekeeper concerned to implement proportionate technical or contractual measures to achieve that goal if the gatekeeper demonstrates that such measures are necessary and justified and that there are no less-restrictive means to safeguard the integrity of the hardware or operating system. The integrity of the hardware or the operating system should include any design options that need to be implemented and maintained in order for the hardware or the operating system to be protected against unauthorised access, by ensuring that security controls specified for the hardware or the operating system concerned cannot be compromised. Furthermore, in order to ensure that third-party software applications or software application stores do not undermine end users’ security, it should be possible for the gatekeeper to implement strictly necessary and proportionate measures and settings, other than default settings, enabling end users to effectively protect security in relation to third-party software applications or software application stores if the gatekeeper demonstrates that such measures and settings are strictly necessary and justified and that there are no less-restrictive means to achieve that goal. The gatekeeper should be prevented from implementing such measures as a default setting or as pre-installation."
REC_51,Recital,Recital (51),,"(51) Gatekeepers are often vertically integrated and offer certain products or services to end users through their own core platform services, or through a business user over which they exercise control which frequently leads to conflicts of interest. This can include the situation whereby a gatekeeper provides its own online intermediation services through an online search engine. When offering those products or services on the core platform service, gatekeepers can reserve a better position, in terms of ranking, and related indexing and crawling, for their own offering than that of the products or services of third parties also operating on that core platform service. This can occur for instance with products or services, including other core platform services, which are ranked in the results communicated by online search engines, or which are partly or entirely embedded in online search engines results, groups of results specialised in a certain topic, displayed along with the results of an online search engine, which are considered or used by certain end users as a service distinct or additional to the online search engine. Other instances are those of software applications which are distributed through software application stores, or videos distributed through a video-sharing platform, or products or services that are given prominence and display in the newsfeed of an online social networking service, or products or services ranked in search results or displayed on an online marketplace, or products or services offered through a virtual assistant. Such reserving of a better position of gatekeeper’s own offering can take place even before ranking following a query, such as during crawling and indexing. For example, already during crawling, as a discovery process by which new and updated content is being found, as well as indexing, which entails storing and organising of the content found during the crawling process, the gatekeeper can favour its own content over that of third parties. In those circumstances, the gatekeeper is in a dual-role position as intermediary for third-party undertakings and as undertaking directly providing products or services. Consequently, such gatekeepers have the ability to undermine directly the contestability for those products or services on those core platform services, to the detriment of business users which are not controlled by the gatekeeper."
REC_52,Recital,Recital (52),,"(52) In such situations, the gatekeeper should not engage in any form of differentiated or preferential treatment in ranking on the core platform service, and related indexing and crawling, whether through legal, commercial or technical means, in favour of products or services it offers itself or through a business user which it controls. To ensure that this obligation is effective, the conditions that apply to such ranking should also be generally fair and transparent. Ranking should in this context cover all forms of relative prominence, including display, rating, linking or voice results and should also include instances where a core platform service presents or communicates only one result to the end user. To ensure that this obligation is effective and cannot be circumvented, it should also apply to any measure that has an equivalent effect to the differentiated or preferential treatment in ranking. The guidelines adopted pursuant to Article 5 of Regulation (EU) 2019/1150 should also facilitate the implementation and enforcement of this obligation."
REC_53,Recital,Recital (53),,"(53) Gatekeepers should not restrict or prevent the free choice of end users by technically or otherwise preventing switching between or subscription to different software applications and services. This would allow more undertakings to offer their services, thereby ultimately providing greater choice to the end users. Gatekeepers should ensure a free choice irrespective of whether they are the manufacturer of any hardware by means of which such software applications or services are accessed and should not raise artificial technical or other barriers so as to make switching impossible or ineffective. The mere offering of a given product or service to consumers, including by means of pre-installation, as well as the improvement of the offering to end users, such as price reductions or increased quality, should not be construed as constituting a prohibited barrier to switching."
REC_54,Recital,Recital (54),,"(54) Gatekeepers can hamper the ability of end users to access online content and services, including software applications. Therefore, rules should be established to ensure that the rights of end users to access an open internet are not compromised by the conduct of gatekeepers. Gatekeepers can also technically limit the ability of end users to effectively switch between different undertakings providing internet access service, in particular through their control over hardware or operating systems. This distorts the level playing field for internet access services and ultimately harms end users. It should therefore be ensured that gatekeepers do not unduly restrict end users in choosing the undertaking providing their internet access service."
REC_55,Recital,Recital (55),,"(55) A gatekeeper can provide services or hardware, such as wearable devices, that access hardware or software features of a device accessed or controlled via an operating system or virtual assistant in order to offer specific functionalities to end users. In that case, competing service or hardware providers, such as providers of wearable devices, require equally effective interoperability with, and access for the purposes of interoperability to, the same hardware or software features to be able to provide a competitive offering to end users."
REC_56,Recital,Recital (56),,"(56) Gatekeepers can also have a dual role as developers of operating systems and device manufacturers, including any technical functionality that such a device may have. For example, a gatekeeper that is a manufacturer of a device can restrict access to some of the functionalities in that device, such as near-field-communication technology, secure elements and processors, authentication mechanisms and the software used to operate those technologies, which can be required for the effective provision of a service provided together with, or in support of, the core platform service by the gatekeeper as well as by any potential third-party undertaking providing such service."
REC_57,Recital,Recital (57),,"(57) If dual roles are used in a manner that prevents alternative service and hardware providers from having access under equal conditions to the same operating system, hardware or software features that are available or used by the gatekeeper in the provision of its own complementary or supporting services or hardware, this could significantly undermine innovation by such alternative providers, as well as choice for end users. The gatekeepers should, therefore, be required to ensure, free of charge, effective interoperability with, and access for the purposes of interoperability to, the same operating system, hardware or software features that are available or used in the provision of its own complementary and supporting services and hardware. Such access can equally be required by software applications related to the relevant services provided together with, or in support of, the core platform service in order to effectively develop and provide functionalities interoperable with those provided by gatekeepers. The aim of the obligations is to allow competing third parties to interconnect through interfaces or similar solutions to the respective features as effectively as the gatekeeper’s own services or hardware."
REC_58,Recital,Recital (58),,"(58) The conditions under which gatekeepers provide online advertising services to business users, including both advertisers and publishers, are often non-transparent and opaque. This often leads to a lack of information for advertisers and publishers about the effect of a given advertisement. To further enhance fairness, transparency and contestability of online advertising services listed in the designation decision, as well as those that are fully integrated with other core platform services of the same undertaking, gatekeepers should provide advertisers and publishers, and third parties authorised by advertisers and publishers, when requested, with free of charge access to the gatekeepers’ performance measuring tools and the data, including aggregated and non-aggregated data, necessary for advertisers, authorised third parties such as advertising agencies acting on behalf of a company placing advertising, as well as for publishers to carry out their own independent verification of the provision of the relevant online advertising services."
REC_59,Recital,Recital (59),,"(59) Gatekeepers benefit from access to vast amounts of data that they collect while providing the core platform services, as well as other digital services. To ensure that gatekeepers do not undermine the contestability of core platform services, or the innovation potential of the dynamic digital sector, by restricting switching or multi-homing, end users, as well as third parties authorised by an end user, should be granted effective and immediate access to the data they provided or that was generated through their activity on the relevant core platform services of the gatekeeper. The data should be received in a format that can be immediately and effectively accessed and used by the end user or the relevant third party authorised by the end user to which the data is ported. Gatekeepers should also ensure, by means of appropriate and high quality technical measures, such as application programming interfaces, that end users or third parties authorised by end users can freely port the data continuously and in real time. This should apply also to any other data at different levels of aggregation necessary to effectively enable such portability. For the avoidance of doubt, the obligation on the gatekeeper to ensure effective portability of data under this Regulation complements the right to data portability under the Regulation (EU) 2016/679. Facilitating switching or multi-homing should lead, in turn, to an increased choice for end users and acts as an incentive for gatekeepers and business users to innovate."
REC_60,Recital,Recital (60),,"(60) Business users that use core platform services provided by gatekeepers, and end users of such business users provide and generate a vast amount of data. In order to ensure that business users have access to the relevant data thus generated, the gatekeeper should, upon their request, provide effective access, free of charge, to such data. Such access should also be given to third parties contracted by the business user, who are acting as processors of this data for the business user. The access should include access to data provided or generated by the same business users and the same end users of those business users in the context of other services provided by the same gatekeeper, including services provided together with or in support of core platform services, where this is inextricably linked to the relevant request. To this end, a gatekeeper should not use any contractual or other restrictions to prevent business users from accessing relevant data and should enable business users to obtain consent of their end users for such data access and retrieval, where such consent is required under Regulation (EU) 2016/679 and Directive 2002/58/EC. Gatekeepers should also ensure the continuous and real time access to such data by means of appropriate technical measures, for example by putting in place high quality application programming interfaces or integrated tools for small volume business users."
REC_61,Recital,Recital (61),,"(61) The value of online search engines to their respective business users and end users increases as the total number of such users increases. Undertakings providing online search engines collect and store aggregated datasets containing information about what users searched for, and how they interacted with, the results with which they were provided. Undertakings providing online search engines collect these data from searches undertaken on their own online search engine and, where applicable, searches undertaken on the platforms of their downstream commercial partners. Access by gatekeepers to such ranking, query, click and view data constitutes an important barrier to entry and expansion, which undermines the contestability of online search engines. Gatekeepers should therefore be required to provide access, on fair, reasonable and non-discriminatory terms, to those ranking, query, click and view data in relation to free and paid search generated by consumers on online search engines to other undertakings providing such services, so that those third-party undertakings can optimise their services and contest the relevant core platform services. Such access should also be given to third parties contracted by a provider of an online search engine, who are acting as processors of this data for that online search engine. When providing access to its search data, a gatekeeper should ensure the protection of the personal data of end users, including against possible re-identification risks, by appropriate means, such as anonymisation of such personal data, without substantially degrading the quality or usefulness of the data. The relevant data is anonymised if personal data is irreversibly altered in such a way that information does not relate to an identified or identifiable natural person or where personal data is rendered anonymous in such a manner that the data subject is not or is no longer identifiable."
REC_62,Recital,Recital (62),,"(62) For software application stores, online search engines and online social networking services listed in the designation decision, gatekeepers should publish and apply general conditions of access that should be fair, reasonable and non-discriminatory. Those general conditions should provide for a Union based alternative dispute settlement mechanism that is easily accessible, impartial, independent and free of charge for the business user, without prejudice to the business user’s own cost and proportionate measures aimed at preventing the abuse of the dispute settlement mechanism by business users. The dispute settlement mechanism should be without prejudice to the right of business users to seek redress before judicial authorities in accordance with Union and national law. In particular, gatekeepers which provide access to software application stores are an important gateway for business users that seek to reach end users. In view of the imbalance in bargaining power between those gatekeepers and business users of their software application stores, those gatekeepers should not be allowed to impose general conditions, including pricing conditions, that would be unfair or lead to unjustified differentiation. Pricing or other general access conditions should be considered unfair if they lead to an imbalance of rights and obligations imposed on business users or confer an advantage on the gatekeeper which is disproportionate to the service provided by the gatekeeper to business users or lead to a disadvantage for business users in providing the same or similar services as the gatekeeper. The following benchmarks can serve as a yardstick to determine the fairness of general access conditions: prices charged or conditions imposed for the same or similar services by other providers of software application stores; prices charged or conditions imposed by the provider of the software application store for different related or similar services or to different types of end users; prices charged or conditions imposed by the provider of the software application store for the same service in different geographic regions; prices charged or conditions imposed by the provider of the software application store for the same service the gatekeeper provides to itself. This obligation should not establish an access right and it should be without prejudice to the ability of providers of software application stores, online search engines and online social networking services to take the required responsibility in the fight against illegal and unwanted content as set out in a Regulation on a single market for digital services."
REC_63,Recital,Recital (63),,"(63) Gatekeepers can hamper the ability of business users and end users to unsubscribe from a core platform service that they have previously subscribed to. Therefore, rules should be established to avoid a situation in which gatekeepers undermine the rights of business users and end users to freely choose which core platform service they use. To safeguard free choice of business users and end users, a gatekeeper should not be allowed to make it unnecessarily difficult or complicated for business users or end users to unsubscribe from a core platform service. Closing an account or un-subscribing should not be made be more complicated than opening an account or subscribing to the same service. Gatekeepers should not demand additional fees when terminating contracts with their end users or business users. Gatekeepers should ensure that the conditions for terminating contracts are always proportionate and can be exercised without undue difficulty by end users, such as, for example, in relation to the reasons for termination, the notice period, or the form of such termination. This is without prejudice to national legislation applicable in accordance with the Union law laying down rights and obligations concerning conditions of termination of provision of core platform services by end users."
