ID,Type,Label,Title,Text
Article_23,Article Paragraph,Art. 23,Powers to conduct inspections,"1.   In order to carry out its duties under this Regulation, the Commission may conduct all necessary inspections of an undertaking or association of undertakings.<br><br>2.   The officials and other accompanying persons authorised by the Commission to conduct an inspection are empowered to:<br><br>(a) enter any premises, land and means of transport of undertakings and associations of undertakings;<br><br>(b) examine the books and other records related to the business, irrespective of the medium on which they are stored;<br><br>(c) take or obtain in any form copies of or extracts from such books or records;<br><br>(d) require the undertaking or association of undertakings to provide access to and explanations on its organisation, functioning, IT system, algorithms, data-handling and business practices and to record or document the explanations given by any technical means;<br><br>(e) seal any business premises and books or records for the duration of, and to the extent necessary for, the inspection;<br><br>(f) ask any representative or member of staff of the undertaking or association of undertakings for explanations of facts or documents relating to the subject-matter and purpose of the inspection, and to record the answers by any technical means.<br><br>3.   To carry out inspections, the Commission may request the assistance of auditors or experts appointed by the Commission pursuant to Article 26(2), as well as the assistance of the national competent authority of the Member State, enforcing the rules referred to in Article 1(6) in whose territory the inspection is to be conducted.<br><br>4.   During inspections the Commission, auditors or experts appointed by it and the national competent authority of the Member State, enforcing the rules referred to in Article 1(6) in whose territory the inspection is to be conducted may require the undertaking or association of undertakings to provide access to and explanations on its organisation, functioning, IT system, algorithms, data-handling and business conducts. The Commission and auditors or experts appointed by it and the national competent authority of the Member State, enforcing the rules referred to in Article 1(6) in whose territory the inspection is to be conducted may address questions to any representative or member of staff.<br><br>5.   The officials and other accompanying persons authorised by the Commission to conduct an inspection shall exercise their powers upon production of a written authorisation specifying the subject matter and purpose of the inspection and the fines provided for in Article 30 applicable in the event that the production of the required books or other records related to the business is incomplete or where the answers to questions asked under paragraphs 2 and 4 of this Article are incorrect or misleading. In good time before the inspection, the Commission shall give notice of the inspection to the national competent authority of the Member State enforcing the rules referred to in Article 1(6) in whose territory it is to be conducted.<br><br>6.   Undertakings or associations of undertakings are required to submit to an inspection ordered by a Commission decision. That decision shall specify the subject matter and purpose of the inspection, set the date on which it is to begin and indicate the fines and periodic penalty payments provided for in Articles 30 and 31 respectively, and the right to have that decision reviewed by the Court of Justice.<br><br>7.   Officials of, and the persons authorised or appointed by, the national competent authority of the Member State enforcing the rules referred to in Article 1(6) in whose territory the inspection is to be conducted shall, at the request of that authority or of the Commission, actively assist the officials and other accompanying persons authorised by the Commission. To this end, they shall enjoy the powers set out in paragraphs 2 and 4 of this Article.<br><br>8.   Where the officials and other accompanying persons authorised by the Commission find that an undertaking or association of undertakings opposes an inspection ordered pursuant to this Article, the Member State concerned shall afford them the necessary assistance, requesting, where appropriate, the assistance of the police or of an equivalent enforcement authority, so as to enable them to conduct their inspection.<br><br>9.   If, according to national rules, the assistance provided for in paragraph 8 of this Article requires authorisation from a judicial authority, the Commission or the national competent authority of the Member State enforcing the rules referred to in Article 1(6) or officials authorised by those authorities shall apply for it. Such authorisation may also be applied for as a precautionary measure.<br><br>10.   Where authorisation referred to in paragraph 9 of this Article is applied for, the national judicial authority shall verify that the Commission decision is authentic and that the coercive measures envisaged are neither arbitrary nor excessive having regard to the subject matter of the inspection. In its control of the proportionality of the coercive measures, the national judicial authority may ask the Commission, directly or through the national competent authority of the Member State, enforcing the rules referred to in Article 1(6), for detailed explanations in particular on the grounds the Commission has for suspecting infringement of this Regulation, as well as on the seriousness of the suspected infringement and on the nature of the involvement of the undertaking concerned. However, the national judicial authority may not call into question the necessity of the inspection nor demand that it be provided with the information in the file of the Commission. The lawfulness of the Commission decision shall be subject to review only by the Court of Justice."
Article_24,Article Paragraph,Art. 24,Interim measures,"In case of urgency due to the risk of serious and irreparable damage for business users or end users of gatekeepers, the Commission may adopt an implementing act ordering interim measures against a gatekeeper on the basis of a prima facie finding of an infringement of Article 5, 6 or 7. That implementing act shall be adopted only in the context of proceedings opened with a view to the possible adoption of a non-compliance decision pursuant to Article 29(1). It shall apply only for a specified period of time and may be renewed in so far this is necessary and appropriate. That implementing act shall be adopted in accordance with the advisory procedure referred to in Article 50(2)."
Article_25,Article Paragraph,Art. 25,Commitments,"1.   If, during proceedings under Article 18, the gatekeeper concerned offers commitments for the relevant core platform services to ensure compliance with the obligations laid down in Articles 5, 6 and 7 the Commission may adopt an implementing act making those commitments binding on that gatekeeper and declare that there are no further grounds for action. That implementing act shall be adopted in accordance with the advisory procedure referred to in Article 50(2).<br><br>2.   The Commission may, upon request or on its own initiative, reopen by decision the relevant proceedings, where:<br><br>(a) there has been a material change in any of the facts on which the decision was based;<br><br>(b) the gatekeeper concerned acts contrary to its commitments;<br><br>(c) the decision was based on incomplete, incorrect or misleading information provided by the parties;<br><br>(d) the commitments are not effective.<br><br>3.   If the Commission considers that the commitments submitted by the gatekeeper concerned cannot ensure effective compliance with the obligations laid down in Articles 5, 6 and 7, it shall explain the reasons for not making those commitments binding in the decision concluding the relevant proceedings."
Article_26,Article Paragraph,Art. 26,Monitoring of obligations and measures,"1.   The Commission shall take the necessary actions to monitor the effective implementation and compliance with the obligations laid down in Articles 5, 6 and 7 and the decisions taken pursuant to Articles 8, 18, 24, 25 and 29. Those actions may include, in particular, the imposition of an obligation on the gatekeeper to retain all documents deemed to be relevant to assess the implementation of, and compliance with, those obligations and decisions.<br><br>2.   The actions pursuant to paragraph 1 may include the appointment of independent external experts and auditors, as well as the appointment of officials from national competent authorities of the Member States, to assist the Commission to monitor the obligations and measures and to provide specific expertise or knowledge to the Commission."
Article_27,Article Paragraph,Art. 27,Information by third parties,"1.   Any third party, including business users, competitors or end-users of the core platform services listed in the designation decision pursuant to Article 3(9), as well as their representatives, may inform the national competent authority of the Member State, enforcing the rules referred to in Article 1(6), or the Commission directly, about any practice or behaviour by gatekeepers that falls within the scope of this Regulation.<br><br>2.   The national competent authority of the Member State, enforcing the rules referred to in Article 1(6), and the Commission shall have full discretion as regards the appropriate measures and are under no obligation to follow-up on the information received.<br><br>3.   Where the national competent authority of the Member State, enforcing the rules referred to in Article 1(6), determines, based on the information received pursuant to paragraph 1 of this Article, that there may be an issue of non-compliance with this Regulation, it shall transfer that information to the Commission."
Article_28,Article Paragraph,Art. 28,Compliance function,"1.   Gatekeepers shall introduce a compliance function, which is independent from the operational functions of the gatekeeper and composed of one or more compliance officers, including the head of the compliance function.<br><br>2.   The gatekeeper shall ensure that the compliance function referred to in paragraph 1 has sufficient authority, stature and resources, as well as access to the management body of the gatekeeper to monitor the compliance of the gatekeeper with this Regulation.<br><br>3.   The management body of the gatekeeper shall ensure that compliance officers appointed pursuant to paragraph 1 have the professional qualifications, knowledge, experience and ability necessary to fulfil the tasks referred to in paragraph 5.<br><br>The management body of the gatekeeper shall also ensure that such head of the compliance function is an independent senior manager with distinct responsibility for the compliance function.<br><br>4.   The head of the compliance function shall report directly to the management body of the gatekeeper and may raise concerns and warn that body where risks of non-compliance with this Regulation arise, without prejudice to the responsibilities of the management body in its supervisory and managerial functions.<br><br>The head of the compliance function shall not be removed without prior approval of the management body of the gatekeeper.<br><br>5.   Compliance officers appointed by the gatekeeper pursuant to paragraph 1 shall have the following tasks:<br><br>(a) organising, monitoring and supervising the measures and activities of the gatekeepers that aim to ensure compliance with this Regulation;<br><br>(b) informing and advising the management and employees of the gatekeeper on compliance with this Regulation;<br><br>(c) where applicable, monitoring compliance with commitments made binding pursuant to Article 25, without prejudice to the Commission being able to appoint independent external experts pursuant to Article 26(2);<br><br>(d) cooperating with the Commission for the purpose of this Regulation.<br><br>6.   Gatekeepers shall communicate the name and contact details of the head of the compliance function to the Commission.<br><br>7.   The management body of the gatekeeper shall define, oversee and be accountable for the implementation of the governance arrangements of the gatekeeper that ensure the independence of the compliance function, including the division of responsibilities in the organisation of the gatekeeper and the prevention of conflicts of interest.<br><br>8.   The management body shall approve and review periodically, at least once a year, the strategies and policies for taking up, managing and monitoring the compliance with this Regulation.<br><br>9.   The management body shall devote sufficient time to the management and monitoring of compliance with this Regulation. It shall actively participate in decisions relating to the management and enforcement of this Regulation and ensure that adequate resources are allocated to it."
Article_29,Article Paragraph,Art. 29,Non-compliance,"1.   The Commission shall adopt an implementing act setting out its finding of non-compliance (‘the non-compliance decision’) where it finds that a gatekeeper does not comply with one or more of the following:<br><br>(a) any of the obligations laid down in Article 5, 6 or 7;<br><br>(b) measures specified by the Commission in a decision adopted pursuant to Article 8(2);<br><br>(c) remedies imposed pursuant to Article 18(1);<br><br>(d) interim measures ordered pursuant to Article 24; or<br><br>(e) commitments made legally binding pursuant to Article 25.<br><br>That implementing act shall be adopted in accordance with the advisory procedure referred to in Article 50(2).<br><br>2.   The Commission shall endeavour to adopt its non-compliance decision within 12 months from the opening of proceedings pursuant to Article 20.<br><br>3.   Before adopting the non-compliance decision, the Commission shall communicate its preliminary findings to the gatekeeper concerned. In those preliminary findings, the Commission shall explain the measures it is considering taking or that it considers that the gatekeeper should take in order to effectively address the preliminary findings.<br><br>4.   Where it intends to adopt a non-compliance decision, the Commission may consult third parties.<br><br>5.   In the non-compliance decision, the Commission shall order the gatekeeper to cease and desist with the non-compliance within an appropriate deadline and to provide explanations on how it plans to comply with that decision.<br><br>6.   The gatekeeper shall provide the Commission with the description of the measures that it has taken to ensure compliance with the non-compliance decision.<br><br>7.   Where the Commission decides not to adopt a non-compliance decision, it shall close the proceedings by a decision."
Article_30,Article Paragraph,Art. 30,Fines,"1.   In the non-compliance decision, the Commission may impose on a gatekeeper fines not exceeding 10 % of its total worldwide turnover in the preceding financial year where it finds that the gatekeeper, intentionally or negligently, fails to comply with:<br><br>(a) any of the obligations laid down in Articles 5, 6 and 7;<br><br>(b) measures specified by the Commission in a decision adopted pursuant to Article 8(2);<br><br>(c) remedies imposed pursuant to Article 18(1);<br><br>(d) interim measures ordered pursuant to Article 24; or<br><br>(e) commitments made legally binding pursuant to Article 25.<br><br>2.   Notwithstanding paragraph 1 of this Article, in the non-compliance decision the Commission may impose on a gatekeeper fines up to 20 % of its total worldwide turnover in the preceding financial year where it finds that a gatekeeper has committed the same or a similar infringement of an obligation laid down in Article 5, 6 or 7 in relation to the same core platform service as it was found to have committed in a non-compliance decision adopted in the 8 preceding years.<br><br>3.   The Commission may adopt a decision, imposing on undertakings, including gatekeepers where applicable, and associations of undertakings, fines not exceeding 1 % of their total worldwide turnover in the preceding financial year where they intentionally or negligently:<br><br>(a) fail to provide within the time limit information that is required for assessing their designation as gatekeepers pursuant to Article 3 or supply incorrect, incomplete or misleading information;<br><br>(b) fail to comply with the obligation to notify the Commission according to Article 3(3);<br><br>(c) fail to notify information or supply incorrect, incomplete or misleading information that is required pursuant to Article 14;<br><br>(d) fail to submit the description or supply incorrect, incomplete or misleading information that is required pursuant to Article 15;<br><br>(e) fail to provide access to data, algorithms or information about testing in response to a request made pursuant to Article 21(3);<br><br>(f) fail to supply the information requested within the time limit fixed pursuant to Article 21(3) or supply incorrect, incomplete or misleading information or explanations that are requested pursuant to Article 21 or given in an interview pursuant to Article 22;<br><br>(g) fail to rectify within a time limit set by the Commission, incorrect, incomplete or misleading information given by a representative or a member of staff, or fail or refuse to provide complete information on facts relating to the subject-matter and purpose of an inspection, pursuant to Article 23;<br><br>(h) refuse to submit to an inspection pursuant to Article 23;<br><br>(i) fail to comply with the obligations imposed by the Commission pursuant to Article 26;<br><br>(j) fail to introduce a compliance function in accordance with Article 28; or<br><br>(k) fail to comply with the conditions for access to the Commission’s file pursuant to Article 34(4).<br><br>4.   In fixing the amount of a fine, the Commission shall take into account the gravity, duration, recurrence, and, for fines imposed pursuant to paragraph 3, delay caused to the proceedings.<br><br>5.   When a fine is imposed on an association of undertakings taking account of the worldwide turnover of its members and that association is not solvent, it shall be obliged to call for contributions from its members to cover the amount of the fine.<br><br>Where such contributions have not been made to the association of undertakings within a time limit set by the Commission, the Commission may require payment of the fine directly by any of the undertakings whose representatives were members of the decision-making bodies concerned of that association.<br><br>After having required payment in accordance with the second subparagraph, the Commission may require payment of the balance by any of the members of the association of undertakings, where necessary to ensure full payment of the fine.<br><br>However, the Commission shall not require payment pursuant to the second or the third subparagraph from undertakings which show that they have not implemented the decision of the association of undertakings that infringed this Regulation, and either were not aware of its existence, or have actively distanced themselves from it before the Commission opened proceedings under Article 20.<br><br>The financial liability of each undertaking in respect of the payment of the fine shall not exceed 20 % of its total worldwide turnover in the preceding financial year."
Article_31,Article Paragraph,Art. 31,Periodic penalty payments,"1.   The Commission may adopt a decision imposing on undertakings, including gatekeepers where applicable, and associations of undertakings periodic penalty payments not exceeding 5 % of the average daily worldwide turnover in the preceding financial year per day, calculated from the date set by that decision, in order to compel them:<br><br>(a) to comply with the measures specified by the Commission in a decision adopted pursuant to Article 8(2);<br><br>(b) to comply with the decision pursuant to Article 18(1);<br><br>(c) to supply correct and complete information within the time limit required by a request for information made by decision pursuant to Article 21;<br><br>(d) to ensure access to data, algorithms and information about testing in response to a request made pursuant to Article 21(3) and to supply explanations on those as required by a decision pursuant to Article 21;<br><br>(e) to submit to an inspection which was ordered by a decision taken pursuant to Article 23;<br><br>(f) to comply with a decision ordering interim measures taken pursuant to Article 24;<br><br>(g) to comply with commitments made legally binding by a decision pursuant to Article 25(1);<br><br>(h) to comply with a decision pursuant to Article 29(1).<br><br>2.   Where the undertakings, or associations of undertakings, have satisfied the obligation which the periodic penalty payment was intended to enforce, the Commission may adopt an implementing act, setting the definitive amount of the periodic penalty payment at a figure lower than that which would arise under the original decision. That implementing act shall be adopted in accordance with the advisory procedure referred to in Article 50(2)."
Article_32,Article Paragraph,Art. 32,Limitation periods for the imposition of penalties,"1.   The powers conferred on the Commission by Articles 30 and 31 shall be subject to a 5 year limitation period.<br><br>2.   Time shall begin to run on the day on which the infringement is committed. However, in the case of continuing or repeated infringements, time shall begin to run on the day on which the infringement ceases.<br><br>3.   Any action taken by the Commission for the purpose of a market investigation or proceedings in respect of an infringement shall interrupt the limitation period for the imposition of fines or periodic penalty payments. The limitation period shall be interrupted with effect from the date on which the action is notified to at least one undertaking or association of undertakings which has participated in the infringement. Actions which interrupt the running of the period shall include in particular the following:<br><br>(a) requests for information by the Commission;<br><br>(b) written authorisations to conduct inspections issued to its officials by the Commission;<br><br>(c) the opening of a proceeding by the Commission pursuant to Article 20.<br><br>4.   Each interruption shall start time running afresh. However, the limitation period shall expire at the latest on the day on which a period equal to twice the limitation period has elapsed without the Commission having imposed a fine or a periodic penalty payment. That period shall be extended by the time during which limitation is suspended pursuant to paragraph 5.<br><br>5.   The limitation period for the imposition of fines or periodic penalty payments shall be suspended for as long as the decision of the Commission is the subject of proceedings pending before the Court of Justice."
Article_33,Article Paragraph,Art. 33,Limitation periods for the enforcement of penalties,"1.   The power of the Commission to enforce decisions taken pursuant to Articles 30 and 31 shall be subject to a limitation period of 5 years.<br><br>2.   Time shall begin to run from the day on which the decision becomes final.<br><br>3.   The limitation period for the enforcement of penalties shall be interrupted:<br><br>(a) by notification of a decision varying the original amount of the fine or periodic penalty payment or refusing an application for variation; or<br><br>(b) by any action of the Commission or of a Member State, acting at the request of the Commission, designed to enforce payment of the fine or periodic penalty payment.<br><br>4.   Each interruption shall start time running afresh.<br><br>5.   The limitation period for the enforcement of penalties shall be suspended for so long as:<br><br>(a) time to pay is allowed; or<br><br>(b) enforcement of payment is suspended pursuant to a decision of the Court of Justice or to a decision by a national court."
